<?xml-stylesheet type="text/xsl" href="../XSLT/MAEK_LMS.xsl"?>
<maek xmlns:xsi="http://www.w3.org/2001/XMLSchema-instance" xsi:noNamespaceSchemaLocation="../XSD/MAEK_LMS.xsd">
  <clients>
    <client dni="12345678A" image="http://">
      <name>Carmen</name>
      <female/>
      <phone>123456789</phone>
    </client>
    
  </clients>
  <products>
    <product id="123A">
      <name>GPU</name>
      <price>12</price>
    </product>
  </products>
</maek>